Название аптеки,Адрес,Телефон,Время работы,Цена
Планета Здоровья Аптека N6 ИООО АБФармация,"Гомель, ул. Советская, 97, к. 2",+375232313796,"09.00-22.00, пн.–пт.; 09.00-22.00, сб.; 09.00-22.00, вс.; Санитарный день 1-й понедельник месяца 09:00-12:00",
Минская Фармация Аптека N209,"Жодино, ул. 8 Марта, 13",(01775) 63045,"09.00-20.00, пн.–пт.; 10.00-18.30, сб.; 10.00-18.30, вс.; Перерыв в субботу и воскресенье: 14:00-14:30; Праздничные дни: выходной;",
InLek Аптека N3 ООО Сеть аптек,"Минск-Октябрьский, ул. Аэродромная, 24-246",(017) 2403725,"09.00-21.00, пн.–пт.; 09.00-21.00, сб.; 09.00-21.00, вс.",
Интернет-магазин aptekatut.by,"Минск, Доставка курьером в пределах г. Минска , сервисом «Европочта» - по всей РБ",(029) 3334400,"09.00-17.30, пн.–пт.; выходной, сб.; выходной, вс.",
Новамедика Аптека N30,"Воложин, г.п. Ивенец, ул. Заслонова, 2Б",(01772) 67647,"выходной, пн.; 10.00-19.00, вт.; 10.00-19.00, ср.; 10.00-19.00, чт.; 10.00-19.00, пт.; 09.00-19.00, сб.; 09.00-19.00, вс.; Санитарный день: третий четверг месяца с 9.00 до 12.00;",
ADEL Аптека N9 ЗАО Аптека групп Север,"Витебск, пр-т Фрунзе, 15-2",(044) 5034264,"08.00-20.00, пн.–пт.; 10.00-16.00, сб.; выходной, вс.",
Гомельское УП Фармация Аптека N47,"Мозырь, д. Слобода, ул. Ленина, 98А",(0236) 205544,"08.30-16.30, пн.–пт.; 09.00-15.00, сб.; выходной, вс.; Обед: 13.00-14.00",
Ледиком ООО Аптека N3,"Борисов, ул. Трусова, 22-122",(0177) 947144,"08.00-00.00, пн.–пт.; 08.00-00.00, сб.; 08.00-00.00, вс.; Перерыв: 14:00-14:30;",
Минская Фармация Аптека N230,"Любань, ул. Первомайская, 97А",(01794) 61643,"07.30-18.00, пн.–пт.; выходной, сб.; выходной, вс.",
Зялёная крама Торговый объект N700 ООО Ирина-Фарм,"Светлогорск, ул. Калинина, 14, центральная районная пол-ка",7822 - А1+mts,"07.30-18.30, пн.–пт.; выходной, сб.; выходной, вс.",
Зеленая Аптека N550 ООО Здоровое Решение,"Минск-Ленинский, ул. Денисовская, 37-34, аптека с отдельным входом",(017) 2150817,"09.00-21.00, пн.–пт.; 09.00-21.00, сб.; 09.00-21.00, вс.; Санитарный день: второй понедельник каждого месяца;",
Юнифарм ООО Аптека N11,"Минск-Советский, Логойский тр-т, 19, к. 1, пом. 1Н",(044) 5071511,"09.00-20.00, пн.–пт.; 10.00-19.00, сб.; 10.00-18.00, вс.",
Добрыя Леки-Эканом Аптека N47 ЗАО Аптека групп Север,"Витебск, ул. Анатолия Богатырева, 7Б-2, маг. Пинскдрев",моб. 5355757,"09.00-21.00, пн.–пт.; 09.00-20.00, сб.; 09.00-20.00, вс.",
Добрыя Леки Аптека N58 ЗАО Аптека групп Север,"Орша, ул. Красноармейская, 14А/3, маг. Спутник",моб. 5355757,"09.00-20.00, пн.–пт.; 09.00-20.00, сб.; 09.00-20.00, вс.",
Гомельское УП Фармация Аптека N187/1,"Гомель, ул. Ильича, 286",(0232) 264096,"08.00-16.30, пн.–пт.; выходной, сб.; выходной, вс.; Перерыв с 12.30 до 13.00",
Гродненское РУП Фармация Аптека N268,"Гродно, аг. Путришки, ул. Интернациональная, 9-3",(0152) 321665,"09.00-15.00, пн.–пт.; выходной, сб.; выходной, вс.; Праздничные дни: выходной",
InLek Аптека N11 ОДО ДКМ-ФАРМ,"Гродно, ул. Пушкина, 31А",(0152) 643669,"09.00-21.00, пн.–пт.; 09.00-21.00, сб.; 09.00-21.00, вс.",
Планета Здоровья Аптека N34 Доктор Время ООО,"Копыль, ул. Тракторная, 1А, Магазин Санта,отдельный вход",+375171925851,"09.00-21.00, пн.–пт.; 09.00-21.00, сб.; 09.00-21.00, вс.; Санитарный день последняя среда месяца 13:00-16:00",
Гомельское УП Фармация Аптека N5/2,"Гомель, ул. Октябрьская, 17-9",(0232) 907571,"08.00-21.00, пн.–пт.; 08.30-20.00, сб.; 08.30-20.00, вс.; Перерыв в субботу и воскресенье: 12:30-13:00;",
Искамед ООО Аптека N23,"Минск-Первомайский, пр-т Независимости, 185",(017) 2240911,"08.00-22.00, пн.–пт.; 09.00-20.00, сб.; 09.00-20.00, вс.; Санитарные часы: четвертая среда каждого месяца с 8:00 до 11:00;",
АльфаАптека Аптека N3 Фитобел ООО,"Минск-Фрунзенский, ул. Лобанка, 26, пом. 4",(017) 3772570,"09.00-21.00, пн.–пт.; 09.00-21.00, сб.; 09.00-21.00, вс.; Санитарные часы: второй вторник месяца с 9.00 до 11.00;",
АльфаАптека Аптека N5 Беллерофон ООО,"Минск-Заводской, ул. Социалистическая, 2, проходная завода МАЗ",(029) 1410046,"09.00-17.00, пн.–пт.; выходной, сб.; выходной, вс.; Санитарные часы: первая пятница месяца с 9:00 до 10:30;",
Зялёная крама Торговый объект N24 ООО Ирина-Фарм,"Минск-Фрунзенский, ул. Петра Глебки, 5, ТЦ Скала",7822 - А1+mts,"10.00-22.00, пн.–пт.; 10.00-22.00, сб.; 10.00-22.00, вс.",
Гродненское РУП Фармация Аптека N17,"Свислочь, г.п. Порозово, ул. Ленина, 24, в здании пол-ки",(01513) 70279,"11.00-16.00, пн.; 08.30-16.00, вт.; 11.00-16.00, ср.; 08.30-16.00, чт.; 11.00-16.00, пт.; выходной, сб.; выходной, вс.; Праздничные дни: выходной;",
Витебское УП Фармация Аптека N271,"Поставы, ул. Ленинская, 151, здание конторы Рассвет, микрорайон МСО",(02155) 20758,"09.00-17.00, пн.–пт.; выходной, сб.; выходной, вс.; Праздничные дни: выходной;",
Добрыя Леки Аптека N64 ЗАО Аптека групп Юг,"Калинковичи, ул. 50 лет Октября, 20Б, маг. Соседи",моб. 5355757,"09.00-21.00, пн.–пт.; 09.00-21.00, сб.; 09.00-21.00, вс.",
Медпростор Салон медтехники и ортопедии N19,"Жодино, ул. 50 лет Октября, 8, пом. 76",(029) 1607500,"08.00-20.00, пн.–пт.; 09.00-18.00, сб.; 09.00-18.00, вс.",
ФармОстров ООО Аптека N8,"Гомель, ул. Кирова, 90",(0232) 259440,"09.00-21.00, пн.–пт.; 09.00-21.00, сб.; 09.00-21.00, вс.",
Брестское РУП Фармация Аптека N185,"Барановичи, б-р Карвата, 6А, в здании детской поликлиники",(0163) 673213,"08.00-20.00, пн.–пт.; 09.00-17.00, сб.; выходной, вс.; Праздничные дни: выходной;",
Гомельское УП Фармация Аптека N4/1,"Гомель, ул. Ильича, 98А, 13 городская пол-ка",(0232) 295866,"07.30-16.00, пн.–пт.; выходной, сб.; выходной, вс.; обед 12.30-13.00",
Медтехника УП Магазин Оптика N1,"Брест, пр-т Машерова, 80",(0162) 209365,"09.00-19.00, пн.–пт.; 09.00-17.00, сб.; 09.00-15.00, вс.",
Плесид ООО Аптека N7,"Столбцы, ул. Первомайская, 1",(044) 5074507,"09.00-20.00, пн.–пт.; 10.00-18.00, сб.; 10.00-18.00, вс.",
Минская Фармация Аптека N87,"Солигорск, д. Долгое, ул. Зеленая, 40",(01742) 32928,"09.00-17.20, пн.–пт.; выходной, сб.; выходной, вс.; Перерыв: 13:00-13:20;",
Столичная Аптека N9 СП Самбест ООО,"Минск-Советский, Логойский тр-т, 37-2, ТЦ Норд Сити",(017) 2701105,"10.00-21.00, пн.–пт.; 10.00-21.00, сб.; 10.00-21.00, вс.; Санитарные часы: третья суббота каждого месяца с 10.00 до 12.00;",
Минская Фармация Аптека N40,"Вилейка, ул. 17 Сентября, 35",(01771) 34890,"09.00-17.30, пн.–пт.; выходной, сб.; выходной, вс.; Перерыв: 14:00-14:30; Праздничные дни: выходной;",
Белфармация Аптека N79 (филиал 1),"Минск-Фрунзенский, ул. Ольшевского, 61, 12-я городская пол-ка",(017) 3790652,"08.00-20.00, пн.–пт.; выходной, сб.; выходной, вс.; Санитарные часы: третья среда каждого месяца с 13:00 до 15:00;",
Гомельское УП Фармация Аптека N66/3,"Калинковичи, ул. Октябрьская, 30",(02345) 53115,"07.30-18.00, пн.–пт.; 07.30-18.00, сб.; 07.30-18.00, вс.; Перерыв с 13.00 до 13.30",
Гомельское УП Фармация Аптека N92,"Петриков, г.п. Копаткевичи, ул. Фрунзе, 3А",(02350) 95576,"09.00-17.00, пн.–пт.; 09.00-17.00, сб.; выходной, вс.; Предпраздничные дни: 9:00-16:00;",
Брестское РУП Фармация Аптека N80,"Пинск, г.п. Логишин, ул. Томилова, 69",(0165) 685896,"09.00-18.00, пн.–пт.; 09.00-17.00, сб.; выходной, вс.; Перерыв: 13.00-14.00; Праздничные дни: выходной;",
Минская Фармация Аптека N64,"Крупки, ул. Черняховского, 2",(01796) 20927,"08.00-17.00, пн.–пт.; 08.00-13.00, сб.; выходной, вс.",
Шарлота ОДО Аптека N12,"Ошмяны, ул. Советская, 100, пом. 2",(01593) 77771,"09.00-21.00, пн.–пт.; 09.00-18.00, сб.; 09.00-18.00, вс.; Праздничные дни: 9.00-17.00;",
Искамед ООО Аптека N121,"Минск-Фрунзенский, ул. Сухаревская, 6, ТЦ на Сухаревской",(017) 3909858,"09.00-21.00, пн.–пт.; 09.00-20.00, сб.; 09.00-20.00, вс.; Санитарные часы: четвертый понедельник каждого месяца с 8:00 до 10:00;",
Медпростор Салон медтехники и ортопедии N51 ООО Пролайф,"Минск-Центральный, ул. Веры Хоружей, 31, пом.4н",(044) 5211116,"09.00-20.00, пн.–пт.; 09.00-20.00, сб.; 09.00-20.00, вс.",
Зялёная крама Торговый объект N707 ООО Ирина-Фарм,"Волковыск, ул. Горбатова, 1, Волковысская районная пол-ка",7822 - А1+mts,"07.30-18.30, пн.–пт.; выходной, сб.; выходной, вс.",
АПТЕЧКА+ Сервис бронирования apte4ka.by,"Солигорск, Самовывоз при бронировании",(29) 6838787,"08.00-21.00, пн.–пт.; 08.00-21.00, сб.; 08.00-20.00, вс.",
Столичная Аптека N12 СП Самбест ООО,"Минск-Московский, пр-т Любимова, 26/1, универсам Курган",(017)  2701893,"10.00-21.00, пн.–пт.; 11.00-21.00, сб.; 11.00-21.00, вс.",
Биотест ООО НПК Аптека N8,"Гродно, б-р Ленинского комсомола, 43Б",(0152) 440499,"09.00-20.00, пн.–пт.; 09.00-20.00, сб.; 09.00-20.00, вс.",
Витебское УП Фармация Аптека N46,"Бешенковичи, аг. Улла, ул. Доватора, 8",(02131) 68570,"09.00-18.00, пн.–пт.; 09.00-17.00, сб.; 09.00-17.00, вс.",
Витебское УП Фармация Аптека N246,"Орша, ул. Островского, 28, 1-я городская пол-ка, 2 этаж",(0216) 541045,"07.30-19.00, пн.–пт.; выходной, сб.; выходной, вс.; Праздничные дни: выходной;",
Минская Фармация Аптека N133,"Нарочь, д. Нарочь, ул. Первомайская, 49-2",(01797) 48236,"09.00-19.00, пн.–пт.; 09.00-15.00, сб.; 09.00-15.00, вс.",
Могилевское РУП Фармация Аптека N213,"Бобруйск, пр-т Строителей, 27, ТЦ Санта",(0225) 726838,"09.30-18.00, пн.–пт.; выходной, сб.; выходной, вс.; Перерыв: 13:00 - 13:30;                    
Праздничные дни: выходной;",
Зялёная крама Торговый объект N45 ООО Ирина-Фарм,"Минск-Фрунзенский, ул. Люцинская, 3, 40-я городская пол-ка, 1 этаж",7822 - А1+mts,"08.00-19.00, пн.–пт.; выходной, сб.; выходной, вс.",
Зялёная крама Торговый объект N703 ООО Ирина-Фарм,"Орша, ул. Новаторов, 3А, 2-я городская пол-ка, 1 этаж",7822 - А1+mts,"08.00-19.00, пн.–пт.; выходной, сб.; выходной, вс.",
Витебское УП Фармация Аптека N313,"Полоцк, пр-т Франциска Скорины, 37/5, рядом маг. Евролюкс",(0214) 438753,"09.00-21.00, пн.–пт.; 09.00-21.00, сб.; 09.00-21.00, вс.; Праздничные дни: 9.00-21.00;",
Доминантафарм ОДО Аптека N12,"Гродно, ул. Золотистая, 19",(0152) 557255,"08.30-20.30, пн.–пт.; 10.00-20.00, сб.; 10.00-20.00, вс.; Праздничные дни: 10.00-18.00; Санитарный день: 2-ой четверг месяца 8.30-11.00;",
Сакавик ООО Аптека N2,"Слуцк, ул. Максима Богдановича, 54, ТЦ Южный",(01795) 28200,"08.00-20.00, пн.–пт.; 08.00-20.00, сб.; 08.00-20.00, вс.",
Брестское РУП Фармация Аптека N117,"Дрогичин, д. Радостово, ул. Восточная, 8, в здании больницы",(01644) 58641,"09.00-17.00, пн.–пт.; выходной, сб.; выходной, вс.; Праздн. дни: выходной;",
Радикс Аптека N4 ООО Диалпро,"Молодечно, г.п. Радошковичи, ул. Минская, 4-1",(0176) 526772,"09.00-21.00, пн.–пт.; 09.00-21.00, сб.; 09.00-21.00, вс.",
Медпростор Салон медтехники и ортопедии N13,"Мозырь, ул. Малинина, 1А/10",(0236) 220550,"09.00-20.00, пн.–пт.; 08.00-18.00, сб.; 08.00-18.00, вс.",
Михалевич ООО Аптека N7,"Лепель, ул. Калинина, 90А",(02132) 63250,"08.30-20.00, пн.–пт.; 09.00-17.00, сб.; 09.00-17.00, вс.; Санитарный час: второй вторник месяца 8.00- 10.00;",
Моя Аптека ООО Аптека N95,"Кобрин, ул. Советская, 6, пом. 1,2,3",(01642) 30330,"09.00-20.00, пн.–пт.; 09.00-19.00, сб.; 09.00-19.00, вс.",
Добрыя Леки Аптека N39 ОДО Амадей,"Лоев, ул. Ленина, 20, маг. Евроопт",моб. 5355757,"09.00-20.00, пн.–пт.; 09.00-20.00, сб.; 09.00-20.00, вс.",
Брестское РУП Фармация Аптека N49,"Пружаны, ул. Советская, 8",(01632) 41196,"08.00-20.00, пн.–пт.; 08.00-16.00, сб.; 08.00-16.00, вс.; Праздн. дни: 8.00-16.00;",
Добрыя Леки Аптека N26 ЗАО Аптека групп Север,"Миоры, ул. Коммунистическая, 52, Беларусьбанк",моб. 5355757,"09.00-20.00, пн.–пт.; 09.00-17.00, сб.; 09.00-17.00, вс.",
Брестское РУП Фармация Аптека N63,"Барановичи, аг. Лесная, ул. Юбилейная, 2, в здании сельсовета",(0163) 601135,"08.30-16.30, пн.–пт.; 08.30-16.30, сб.; выходной, вс.; Праздничные дни: выходной;",
Могилевское РУП Фармация Аптека N215,"Могилев, ул. Габровская, 32, маг. Санта",(0222) 743419,"08.20-21.00, пн.–пт.; 08.20-21.00, сб.; 08.20-21.00, вс.; Праздничные дни: 8.20-21.00;",
Столичная Аптека N23 СП Самбест ООО,"Минск-Фрунзенский, ул. Бурдейного, 6В, ТЦ Топ",(017) 3737032,"08.00-20.00, пн.–пт.; 10.00-20.00, сб.; 10.00-20.00, вс.",
Скажи здоровью ДА! магазин медтехники N4 ООО Яндейл,"Несвиж, ул. Ленинская, 11",(01770) 25736,"09.00-19.00, пн.–пт.; 09.00-17.00, сб.; 09.00-14.00, вс.",
Минская Фармация Аптека N139,"Боровляны, аг. Лесной, МОКБ",(017) 2682599,"08.00-20.00, пн.–пт.; 08.00-20.00, сб.; 08.00-20.00, вс.",
Доминантафарм ОДО Аптека N22,"Минск-Фрунзенский, ул. Маршала Лосика, 31, п. 576",(017) 3222262,"09.00-21.00, пн.–пт.; 10.00-20.00, сб.; 10.00-18.00, вс.",
Моя Аптека ООО Аптека N81,"Могилев, ул. Бялыницкого-Бирули, 1, мед. центр Евромедика",(0222) 633333,"08.00-20.00, пн.–пт.; 09.00-18.00, сб.; 09.00-18.00, вс.; Первый понедельник месяца-сан. день",
Витвар ООО Аптека N14,"Витебск, ул. Ленинградская, 135А",(0212) 374956,"09.00-21.00, пн.–пт.; 09.00-21.00, сб.; 09.00-21.00, вс.",
Гродненское РУП Фармация Аптека N222,"Лида, аг. Можейково, ул. Победы, 7",(01546) 21234,"08.30-15.30, пн.; выходной, вт.; 08.30-15.30, ср.; выходной, чт.; 08.30-14.30, пт.; выходной, сб.; выходной, вс.; Праздничные дни: выходной",
Минская Фармация Аптека N121,"Вилейка, д. Ижа, ул. Советская, 20",(01771) 41162,"08.30-17.00, пн.–пт.; выходной, сб.; выходной, вс.; Перерыв: 13:00-13:30;",
ADEL Аптека N65 ООО Аптека групп Центр,"Минск-Московский, пр-т Дзержинского, 19",(044) 5034264,"09.00-22.00, пн.–пт.; 09.00-22.00, сб.; 09.00-22.00, вс.",
Медтехника РУП Магазин Оптика N1,"Могилев, ул. Челюскинцев, 59а",(0222) 628809,"08.30-19.00, пн.–пт.; 09.00-17.00, сб.; выходной, вс.",
Белфармация Аптека N23 (филиал 3),"Минск-Ленинский, пер. Рабочий, 5, пом. 3Н, р-н кинотеатра Ракета",(017) 3904527,"08.00-21.00, пн.–пт.; 10.00-18.00, сб.; 10.00-18.00, вс.; Санитарные часы: вторая пятница каждого месяца с 8.00 до 10.00;",
Аптека АстраФарма N2 ООО Кладовая здоровья,"Гомель, ул. Владимирова, 61-115",(0232) 212310,"09.00-21.00, пн.–пт.; 09.00-21.00, сб.; 09.00-21.00, вс.; Санитарные часы: первое воскресенье каждого месяца с 19:00 до 21:00;",
Белфармация Аптека N75 (филиал 2),"Минск-Советский, ул. Кольцова, 53/2, 30-я городская пол-ка",(017) 3770413,"08.00-20.00, пн.–пт.; выходной, сб.; выходной, вс.; Санитарные часы: первая пятница каждого месяца с 18:00 до 20:00;",
Брестское РУП Фармация Аптека N57,"Брест, ул. Мицкевича, 27-1",(0162) 510242,"07.30-19.30, пн.–пт.; 08.00-18.00, сб.; 08.00-18.00, вс.; Праздничные дни: выходной;",
Медтехника УП Магазин Оптика,"Пружаны, ул. Октябрьская, 60",(01632) 44208,"09.00-18.00, пн.; 09.00-19.00, вт.; 09.00-19.00, ср.; 09.00-19.00, чт.; 09.00-19.00, пт.; 09.00-17.00, сб.; выходной, вс.; Обед в Пн 12.30 - 13.30",
Гомельское УП Фармация Аптека N95/3,"Петриков, ул. Бумажкова, 3В",(02350) 22939,"09.00-21.00, пн.–пт.; 09.00-21.00, сб.; 09.00-21.00, вс.; Перерыв: 14:00-14:30;",
Брестское РУП Фармация Аптека N266,"Кобрин, ул. Дзержинского, 131, маг. Санта",(01642) 46603,"10.00-21.00, пн.–пт.; 10.00-20.00, сб.; 10.00-20.00, вс.; Праздничные дни: выходной;",
Добрыя Леки Аптека N8 Либерти-фарм ООО,"Минск-Ленинский, ул. Янки Лучины, 44-1, маг. Соседи",моб. 5355757,"09.00-21.00, пн.–пт.; 09.00-21.00, сб.; 09.00-21.00, вс.",
Добрыя Леки Аптека N41 ЗАО Аптека групп Север,"Полоцк, пр-т Зодчего Иоанна, 16, маг. Дионис",(044) 5034264,"09.00-21.00, пн.–пт.; 09.00-21.00, сб.; 09.00-21.00, вс.",
Ремедика Бальзам ООО Аптека N13,"Брест, ул. Советская, 25",(0162) 214600,"08.00-21.00, пн.–пт.; 08.00-20.00, сб.; 08.00-20.00, вс.",
Зялёная крама Торговый объект N709 ООО Ирина-Фарм,"Гомель, ул. Катунина, 1А",7822 - А1+mts,"08.00-20.00, пн.–пт.; 08.00-20.00, сб.; 08.00-20.00, вс.",
Гродненское РУП Фармация Аптека N253,"Гродно, ул. Южная, 30, ТЦ МегаБрэнд",(0152) 632607,"10.00-20.00, пн.–пт.; 10.00-17.00, сб.; 10.00-17.00, вс.; Праздничные дни: 10:00-17:00;",
АльфаАптека Аптека N18 ОДО Меджел,"Жодино, ул. Советская, 1В, пом. 49, маг. Санта",(01775) 58784,"09.00-21.00, пн.–пт.; 09.00-21.00, сб.; 09.00-21.00, вс.; Сандень первый вторник месяца: 9:00-11:00",
Планета Здоровья Аптека N11 ООО Нелли-фарм,"Гомель, ул. Чечерская, 1Б, Магазин Санта",+375293337604,"09.00-22.00, пн.–пт.; 09.00-21.00, сб.; 09.00-21.00, вс.; Санитарный день 3-й  вторник месяца 09:00-12:00",
Могилевское РУП Фармация Аптека N37,"Могилев, ул. Академика Павлова, 2А, Онкодиспансер",(0222) 604120,"08.00-16.30, пн.–пт.; выходной, сб.; выходной, вс.; Перерыв: 12:30-13:00; Праздничные дни: выходной;",
Гомельское УП Фармация Аптека N90/3,"Житковичи, ул. Школьная, 3, маг. Евроопт",(02353) 30479,"09.00-20.00, пн.–пт.; 09.00-19.30, сб.; 09.00-19.30, вс.; Перерыв в субботу и воскресенье: 14:00-14:30;",
Искамед ООО Аптека N70,"Фаниполь, ул. Зеленая, 2Г",(01716) 94111,"09.00-20.00, пн.–пт.; 09.00-17.00, сб.; 09.00-17.00, вс.; Санитарные часы: четвертый вторник каждого месяца с 9:00 до 12:00;",
Моя Аптека ООО Аптека N87,"Иваново, ул. Советская, 46-49",(01652) 20020,"09.00-20.00, пн.–пт.; 09.00-20.00, сб.; 09.00-20.00, вс.",
Медицинский магазин N19 Польза,"Гомель, ул. Интернациональная, 48",(029) 6513028,"09.00-20.00, пн.–пт.; 09.00-20.00, сб.; 09.00-18.00, вс.",
Добрыя Леки-Эканом Аптека N78 ООО Аптека групп Центр,"Минск-Советский, ул. Максима Богдановича, 78",моб. 5355757,"09.00-21.00, пн.–пт.; 09.00-21.00, сб.; 09.00-21.00, вс.",
Лигматон ООО Аптека N8,"Солигорск, ул. Заслонова, 29, ТЦ Корона",(0174) 323030,"09.00-23.00, пн.–пт.; 09.00-23.00, сб.; 09.00-23.00, вс.; Санитарные часы: первая среда каждого месяца с 9.00 до 12.00;",
Добрыя Леки-Эканом Аптека N59 ООО Аптека групп Запад,"Гродно, ул. Курчатова, 22-231",моб. 5355757,"09.00-21.00, пн.–пт.; 09.00-21.00, сб.; 09.00-21.00, вс.",
Медвакс СЗАО Аптека N18,"Минск-Центральный, ул. Репина, 4",(017) 3183749,"08.00-21.00, пн.–пт.; 10.00-20.00, сб.; 10.00-17.00, вс.",
