Название аптеки,Адрес,Телефон,Время работы,Цена
Зялёная крама Торговый объект N750 ООО Здоровое решение,"Лида, ул. Качана, 29, островок в ТЦ Лида Парк",7822 - А1+mts,"10.00-22.00, пн.–пт.; 10.00-22.00, сб.; 10.00-22.00, вс.",
Биотест ООО НПК Аптека N6,"Гродно, ул. Буденного, 28-54",(0152) 719735,"09.00-20.00, пн.–пт.; 09.00-20.00, сб.; 09.00-19.00, вс.",
Брестское РУП Фармация Аптека N275,"Ивацевичи, ул. Механизаторов, 7Е",(01645)  92790,"выходной, пн.; 10.30-19.00, вт.; 10.30-19.00, ср.; 10.30-19.00, чт.; 10.30-19.00, пт.; 09.00-17.00, сб.; выходной, вс.; Перерыв во вторник-пятницу: 14:00-14:30; Праздничные дни: выходной;",
Медвакс СЗАО Аптека N20,"Минск-Московский, Щомыслицкий с/с, ТЦ Диамант",(017) 2754432,"09.00-22.00, пн.–пт.; 09.00-22.00, сб.; 09.00-22.00, вс.",
Минская Фармация Аптека N292,"Столбцы, ул. Социалистическая, 97, пом. 14",(01717) 76902,"выходной, пн.; 09.00-17.30, вт.; 09.00-17.30, ср.; 09.00-17.30, чт.; 09.00-17.30, пт.; 09.00-17.30, сб.; выходной, вс.",
Ремедика Бальзам ООО Аптека N19,"Пинск, ул. Парковая, 146А",(0165) 662089,"09.00-21.00, пн.–пт.; 09.00-18.00, сб.; 09.00-17.00, вс.",
Гомельское УП Фармация Аптека N168,"Светлогорск, ул. Батова, 5",(02342) 23499,"08.00-20.00, пн.–пт.; 08.00-20.00, сб.; 08.00-20.00, вс.; Перерыв в субботу и воскресенье : 13:30-14:00;",
"Оптика сладких цен ""Халва"" N2 ООО Голд оптик","Минск-Первомайский, ул. Гинтовта, 14",(044) 5771995,"10.00-20.00, пн.–пт.; 10.00-19.00, сб.; 10.00-19.00, вс.",
Брестское РУП Фармация Аптека N252,"Барановичи, ул. Фроленкова, 13, в здании ЖД вокзала",(0163) 641702,"выходной, пн.; 07.30-17.30, вт.; 07.30-17.30, ср.; 07.30-17.30, чт.; 07.30-17.30, пт.; 07.30-17.30, сб.; 07.30-17.30, вс.; Праздничные дни: выходной;",
Ледафарммед ООО Аптека N1,"Лида, ул. Советская, 1",(0154) 610688,"09.00-20.00, пн.–пт.; 09.00-18.00, сб.; 09.00-18.00, вс.; Санитарные часы: первый понедельник каждого месяца с 9:00 до 11:00;",
Столичная Аптека N25 СП Самбест ООО,"Минск-Первомайский, пр-т Независимости, 103, пом. 1Н",(017) 3540550,"08.00-22.00, пн.–пт.; 08.00-20.00, сб.; 09.00-20.00, вс.",
Брестское РУП Фармация Аптека N61,"Барановичи, аг. Жемчужный, ул. Ленина, 3, в здании амбулатории",(0163) 656033,"08.00-20.00, пн.–пт.; 08.00-19.00, сб.; 09.00-17.00, вс.; Праздничные дни: выходной;",
Минская Фармация Аптека N207,"Жодино, ул. 50 лет Октября, 17, городская пол-ка",(01775) 64670,"08.00-20.00, пн.–пт.; 09.00-15.00, сб.; выходной, вс.",
Брестское РУП Фармация Аптека N276,"Ивацевичи, ул. Депутатская, 47, маг. Санта",(01645) 99818,"07.00-22.00, пн.–пт.; 09.00-19.00, сб.; 09.00-19.00, вс.; Праздничные дни: 9:00-19:00;",
Оффицина ЗАО Аптека N12,"Светлогорск, ул. 50 лет Октября, 3",(02342) 32730,"09.00-20.00, пн.–пт.; 09.00-20.00, сб.; 09.00-20.00, вс.",
Юнифарм ООО Аптека N16,"Жодино, пр-т Ленина, 17, к. 3",(044) 5071516,"09.00-20.00, пн.–пт.; 10.00-18.00, сб.; 10.00-18.00, вс.",
Искамед ООО Аптека N24,"Светлогорск, ул. Луначарского, 7А-1",(02342) 26939,"08.00-20.00, пн.–пт.; 09.00-17.00, сб.; 09.00-17.00, вс.; Санитарные часы: четвертый четверг каждого месяца с 8:00 до 11:00;",
Минская Фармация Аптека N93,"Любань, пос. Сосны, ул. Центральная, 18А",(01794) 37338,"08.00-17.00, пн.–пт.; выходной, сб.; выходной, вс.; Перерыв: 13:00-14:00;",
АльфаАптека Аптека N2 ГаленаФарм ООО,"Пинск, ул. Первомайская, 53-39",(0165) 622850,"08.00-21.00, пн.–пт.; 09.00-21.00, сб.; 09.00-21.00, вс.; Санитарные часы: первый понедельник месяца с 8.00 до 10.00;",
Моя Аптека ООО Аптека N16,"Могилев, ул. Буденного, 13-76, рядом с кинотеатром Родина",(0222) 759393,"09.00-20.00, пн.–пт.; 09.00-18.00, сб.; 09.00-18.00, вс.",
ADEL Аптека N20 ООО Аптека групп Центр,"Минск-Первомайский, ул. Кирилла Туровского, 4-264",(044) 5034264,"10.00-21.00, пн.–пт.; 10.00-21.00, сб.; 10.00-20.00, вс.",
Лигматон ООО Аптека N12,"Барановичи, пр-т Советский, 2-1, ТЦ Корона",(0163) 618783,"09.00-22.00, пн.–пт.; 09.00-22.00, сб.; 09.00-22.00, вс.; Санитарные часы: первый вторник месяца c 9.00 до 11.00",
Гомельское УП Фармация Аптека N168/9,"Светлогорск, ул. Ленина, 44, кафе Свитанак",(02342) 30782,"10.00-19.00, пн.–пт.; 10.00-19.00, сб.; 10.00-19.00, вс.; Перерыв: 14:00-15:00;",
БелЛекоЦентр РУП Государственная аптека N4,"Минск-Центральный, пр-т Победителей, 23, к. 1",(017) 3285592,"09.00-17.00, пн.–пт.; выходной, сб.; выходной, вс.; Санитарный день: первый понедельник месяца c 14.00 до 17.00",
Брестское РУП Фармация Аптека N165,"Брест, ул. Орловская, 24, в здании Белпочты",(0162) 250658,Круглосуточно,
Добрыя Леки Аптека N10 ОДО Амадей,"Гомель, пр-т Космонавтов, 61А",моб. 5355757,"08.00-22.00, пн.–пт.; 08.00-22.00, сб.; 08.00-22.00, вс.",
Медтехника УП Магазин Медтехника N7,"Гомель, ул. Медицинская, 4, кардиологический центр, вход с улицы",(0232) 295947,"09.00-17.00, пн.–пт.; выходной, сб.; выходной, вс.; Перерыв: 13:00-13:30;",
Промснабсервис ЗАО Аптека N10 пятой категории,"Барановичи, ул. Наконечникова, 32",(0163) 668916,"09.00-20.00, пн.–пт.; 09.00-19.00, сб.; 09.00-19.00, вс.",
Могилевское РУП Фармация Аптека N48,"Осиповичи, ул. Октябрьская, 2",(02235) 26426,"08.30-17.00, пн.–пт.; выходной, сб.; выходной, вс.; Перерыв: 13.30-14.00              
Праздничные дни: выходной",
Брестское РУП Фармация Аптека N277,"Пинск, ул. Железнодорожная, 19, маг. Август",(0165) 650058,"09.30-20.00, пн.–пт.; 09.30-20.00, сб.; 09.30-20.00, вс.; Перерыв: 14.00-14.30; Праздничные дни: выходной;",
Минская Фармация Аптека N284,"Молодечно, ул. Ларина, 1",(0176) 504609,"09.30-18.00, пн.–пт.; выходной, сб.; выходной, вс.; Перерыв: 14:00-14:30;",
Витебское УП Фармация Аптека N194,"Витебск, аг. Октябрьская, ул. Октябрьская, 6, врачебная амбулатория",(0212) 697407,"08.00-16.00, пн.–пт.; выходной, сб.; выходной, вс.",
Олана Плюс ОДО Аптека N4,"Брест, ул. Махновича, 6",(0162) 258256,"09.00-21.00, пн.–пт.; 09.00-21.00, сб.; 09.00-21.00, вс.",
Могилевское РУП Фармация Аптека N205,"Кричев, ул. Тимирязева, 1А, пом. 1",(02241) 55367,"10.00-18.30, пн.–пт.; выходной, сб.; выходной, вс.; Перерыв: 14.00 - 14.30; 
Праздничные дни: выходной",
Белфармация Аптека N75 (филиал 4),"Минск-Советский, ул. Мирошниченко, 3-5А",(017) 3782030,"08.00-22.00, пн.–пт.; 08.00-22.00, сб.; 08.00-22.00, вс.; Санитарные часы: последнее воскресенье каждого месяца с 8:00 до 10:00;",
Добрыя Леки Аптека N27 ЗАО Аптека групп Север,"Лепель, ул. Володарского, 28Б-2",моб. 5355757,"09.00-19.00, пн.–пт.; 09.00-15.00, сб.; 09.00-15.00, вс.",
Добрыя Леки Аптека N81 ЗАО Аптека групп Юг,"Осиповичи, ул. Сумченко, 57А-15",моб. 5355757,"09.00-20.00, пн.–пт.; 09.00-20.00, сб.; 09.00-20.00, вс.",
Минская Фармация Аптека N301,"Смолевичи, ул. 50 лет Октября, 4",(01776) 61350,"10.30-20.30, пн.–пт.; 10.30-19.00, сб.; 10.30-19.00, вс.; Перерыв: 14:30-15:00; Праздничные дни: 10:30-19:00;",
Белфармация Аптека N34 (филиал 3),"Минск-Партизанский, ул. Фроликова, 3-3",(017) 2602786,"10.00-20.00, пн.–пт.; 09.00-17.00, сб.; выходной, вс.; Перерыв в субботу: 13:00-13:30; Санитарные часы: третья среда каждого месяца с 12:00-14:00;",
Могилевское РУП Фармация Аптека N160,"Кричев, ул. Комсомольская, 62, пом. 2,3",(02241) 29074,"выходной, пн.; 09.00-17.30, вт.; 09.00-17.30, ср.; 09.00-17.30, чт.; 09.00-17.30, пт.; 09.00-17.30, сб.; 09.00-17.30, вс.; Перерыв: 14:00-14:30; Праздничные дни: выходной;",
Гомельское УП Фармация Аптека N185/3,"Гомель, ул. Огоренко, 33",(0232) 553575,"08.30-21.00, пн.–пт.; 08.30-21.00, сб.; 08.30-21.00, вс.; Перерыв: 12:30-13:00;",
Белана ООО ПКФ Аптека N14,"Мосты, ул. 30 лет ВЛКСМ, 18, маг. Санта",(01515) 32013,"09.00-21.00, пн.–пт.; 09.00-21.00, сб.; 09.00-21.00, вс.; Санитарные часы: последнее воскресенье месяца 19.00-21.00",
АльфаАптека Аптека N1 ОДО Салюслайн,"Гродно, ул. Советская, 15-17",(0152) 621544,"09.00-20.00, пн.–пт.; 09.00-20.00, сб.; 10.00-19.00, вс.; Санитарные часы: третий четверг месяца с 9.00 до 11.00;",
Добрыя Леки Аптека N25 ОДО Амадей,"Гомель, пр-т Речицкий, 75-198, рядом маг. Красный пищевик",моб. 5355757,"09.00-21.00, пн.–пт.; 09.00-20.00, сб.; 09.00-20.00, вс.",
Искамед ООО Аптека N20,"Минск-Московский, ул. Московская, 16",(017) 2488283,"08.00-21.00, пн.–пт.; 08.00-20.00, сб.; 08.00-20.00, вс.; Санитарные часы: четвертый четверг каждого месяца с 8:00 до 11:00;",
Могилевское РУП Фармация Аптека N45,"Могилев, пр-т Шмидта, 41, п-ка №6",(0222) 745822,"07.30-20.00, пн.–пт.; выходной, сб.; выходной, вс.; В праздничные дни аптека не работает;",
Календула ЧУП Аптека N1,"Островец, ул. Карла Маркса, 13-1, ТЦ Талер",(01591) 78015,"08.00-21.00, пн.–пт.; 09.00-19.00, сб.; 09.00-19.00, вс.",
АльфаАптека Аптека N26 Фитобел ООО,"Минск-Московский, ул. Слободская, 47",(017) 3631679,"09.00-21.00, пн.–пт.; 09.00-21.00, сб.; 09.00-21.00, вс.; Санитарные часы: второй вторник месяца с 9.00 до 12.00;",
Гомельское УП Фармация Аптека N170,"Гомель, ул. Минская, 34",(0232) 265774,"08.00-20.00, пн.–пт.; 08.00-20.00, сб.; 08.00-20.00, вс.; Перерыв: 13:30-14:00;",
Гродненское РУП Фармация Аптека N258,"Слоним, ул. Красноармейская, 73Г, супермаркет Светофор",(01562) 25579,"09.00-22.20, пн.; 09.00-22.00, вт.; 09.00-22.00, ср.; 09.00-22.00, чт.; 09.00-22.00, пт.; 09.00-22.00, сб.; 09.00-22.00, вс.; Праздничные дни: 9:00-22:00;",
Комфарм ООО Аптека N12,"Барановичи, ул. Баранова, 34, ул. Войкова, 14-3",(0163) 633821,"08.00-22.00, пн.–пт.; 08.00-22.00, сб.; 08.00-22.00, вс.",
Моя Аптека ООО Аптека N44,"Мозырь, ул. Нефтестроителей, 26-1, ТЦ Апельсин",(0236) 201920,"10.00-19.00, пн.–пт.; 10.00-18.00, сб.; 10.00-18.00, вс.",
Добрыя Леки Аптека N39 ЗАО Аптека групп Юг,"Гомель, ул. Каменщикова, 3",моб. 5355757,"09.00-18.00, пн.–пт.; 09.00-18.00, сб.; 09.00-18.00, вс.",
Планета Здоровья Аптека N13 ООО ДОКТОР ТАИР,"Могилев, ул. Гагарина, 79, Магазин Евроопт",+375222783417,"09.00-22.00, пн.–пт.; 09.00-22.00, сб.; 09.00-22.00, вс.; Санитарный день 2-й вторник месяца 9:00-12:00",
Ремедика ЛКЛ ООО Аптека N22,"Гомель, ул. Богданова, 10А, маг. Светофор",(0232) 240736,"10.00-19.00, пн.–пт.; 10.00-17.00, сб.; выходной, вс.",
Искамед ООО Аптека N51,"Гродно, пр-т Космонавтов, 27",(0152) 717150,"09.00-21.00, пн.–пт.; 09.00-18.00, сб.; 09.00-18.00, вс.; Санитарные часы: четвертая среда каждого месяца с 9:00 до 12:00;",
Медтехника УП Киоск на площадях ГОДКБ,"Гомель, ул. Жарковского, 7, корпус Б, фойе, справочная N2",(044) 7977834,"08.00-16.00, пн.–пт.; выходной, сб.; выходной, вс.; Обед: 12:00-12:30",
Добрыя Леки Аптека N92 ООО Аптека групп Центр,"Минск-Ленинский, пер. 2-й Велосипедный, 32-4",моб. 5355757,"09.00-21.00, пн.–пт.; 09.00-20.00, сб.; 10.00-19.00, вс.",
Добрыя леки Аптека N82 ЗАО Аптека групп Юг,"Гомель, ул. Мазурова, 36-3",моб. 5355757,"09.00-21.00, пн.–пт.; 09.00-21.00, сб.; 09.00-21.00, вс.",
Гомельское УП Фармация Аптека N22,"Речица, ул. Светлогорское шоссе, 7/1",(02340) 29798,"08.00-20.00, пн.–пт.; 08.00-20.00, сб.; 08.00-20.00, вс.; Перерыв в субботу и воскресенье: 14:00-14:30;",
Витебское УП Фармация Аптека N218,"Шумилино, ул. Суворова, 1",(02130) 55761,"08.00-17.00, пн.–пт.; выходной, сб.; выходной, вс.; Праздничные дни: выходной;",
Зялёная крама Торговый объект N755 ООО Ирина-Фарм,"Гомель, ул. Мазурова, 10В-2",7822 - А1+mts,"08.00-19.00, пн.–пт.; выходной, сб.; выходной, вс.",
Мелисса Аптека N2 УП МедФармИнвест,"Минск-Заводской, ул. Ташкентская, 6А",(017) 3778866,"09.00-20.00, пн.–пт.; 10.00-20.00, сб.; 10.00-18.00, вс.",
Гомельское УП Фармация Аптека N4,"Гомель, ул. Ильича, 87",(0232) 258681,"08.00-21.00, пн.–пт.; 08.00-20.00, сб.; 08.00-20.00, вс.",
БелЛекоЦентр РУП Государственная аптека N2,"Минск-Ленинский, ул. Маяковского, 24, пом. 3Н",(017) 3626939,"08.00-20.00, пн.–пт.; выходной, сб.; выходной, вс.; Санитарный день: первый четверг месяца c 9.00 до 12.00;",
InLek Аптека N20 ООО Сеть аптек,"Минск-Первомайский, ул. Городецкая, 30, маг. Гиппо",(017) 3578716,"09.00-23.00, пн.–пт.; 09.00-23.00, сб.; 09.00-23.00, вс.",
АльфаАптека Аптека N23 Табина ООО,"Минск-Заводской, пр-т Партизанский, 81Д-17, м. Партизанская, подземный переход, выход в сторону ул. Жилуновича",(029) 3987003,"08.00-22.00, пн.–пт.; 08.00-22.00, сб.; 09.00-21.00, вс.; Санитарные часы: второй понедельник месяца с 8.00 до 10.00;",
Брестское РУП Фармация Аптека N260,"Кобрин, ул. Дружбы, 47-39",(01642) 51756,"09.00-21.00, пн.–пт.; 10.00-18.00, сб.; 10.00-18.00, вс.; Праздничные дни: выходной;",
Гродненское РУП Фармация Аптека N44,"Лида, ул. Рыбиновского, 24",(0154) 626123,"09.00-18.00, пн.–пт.; 00.00-00.00, сб.; 00.00-00.00, вс.; Праздничные дни: выходной",
Витебское УП Фармация Аптека N107,"Витебск, ул. Партизанская, 6А, ФАП, конечная ост-ка автобуса N26, Верховье",(0212) 697316,"08.10-18.00, пн.; 08.10-13.25, вт.; 08.10-18.00, ср.; 08.10-13.25, чт.; 08.10-18.00, пт.; выходной, сб.; выходной, вс.; Праздничные дни: выходной;",
Планета Здоровья Аптека N6 ООО Аптека N28,"Минск-Октябрьский, ул. Могилевская, 12-2, Магазин Дионис",+375173770714,"09.00-22.00, пн.–пт.; 09.00-21.00, сб.; 09.00-21.00, вс.; Санитарный день 1-й четверг месяца 8:00-11:00",
АльфаАптека Аптека N32 Фитобел ООО,"Минск-Советский, ул. Некрасова, 3А, магазин Гиппо",(017) 3966434,"09.00-21.00, пн.–пт.; 09.00-21.00, сб.; 09.00-21.00, вс.; Санитарные часы: вторая среда месяца с 9.00 до 11.00;",
Гродненское РУП Фармация Аптека N12,"Щучин, г.п. Желудок, ул. Советская, 15-2",(01514) 79367,"09.00-18.00, пн.–пт.; выходной, сб.; 09.00-14.00, вс.; Праздничные дни: выходной;",
Планета Здоровья Аптека N36 ООО Космофарма,"Жодино, пр-т Мира, 8Б",+375177545287,"08.30-20.30, пн.–пт.; 08.30-20.30, сб.; 08.30-20.30, вс.; Санитарный день первая среда месяца 8.00-10.00",
Формула жизни плюс Аптека N3,"Брест, наб. Франциска Скорины, 32, пом. 112",(0162) 527088,"09.00-21.00, пн.–пт.; 11.00-19.00, сб.; 11.00-19.00, вс.; Сан. день: 3-ий четверг месяца с 9.00-12.00",
Моя Аптека ООО Аптека N52,"Лунинец, ул. Чехова, 2-2",(01647) 45383,"09.00-20.00, пн.–пт.; 09.00-18.00, сб.; 09.00-18.00, вс.",
Моя Аптека ООО Аптека N94,"Дрогичин, ул. Ленина, 141А, пом. 3",(01644) 48884,"09.00-20.00, пн.–пт.; 09.00-17.00, сб.; 09.00-17.00, вс.; Праздничные дни с 9:00 до 17:00;
Санитарный день - последний понедельник месяца.",
Белфармация Аптека N104 (филиал 3),"Минск-Центральный, пр-т Победителей, 93, 4-я городская пол-ка",(017) 3736834,"08.00-20.00, пн.–пт.; выходной, сб.; выходной, вс.; Санитарные часы: третья среда каждого месяца с 13:00 до 15:00;",
Медвай УП Аптека N2,"Минск-Октябрьский, ул. Ленинградская, 1",(017) 3181453,"08.00-20.00, пн.–пт.; 09.00-20.00, сб.; 10.00-17.00, вс.; Возможны изменения в режиме работы аптек! Уточняйте звонком!",
Минская Фармация Аптека N2,"Клецк, аг. Заостровечье, ул. Янки Купалы, 3",(01793) 65168,"08.40-17.00, пн.–пт.; выходной, сб.; выходной, вс.",
Белфармация Аптека N55 (филиал 1),"Минск-Первомайский, ул. Карбышева, 1, женская консультация пол-ки N27",(017) 3580609,"07.30-18.00, пн.–пт.; выходной, сб.; выходной, вс.; Санитарные часы: первый рабочий день каждого месяца до 9:30;",
Могилевское РУП Фармация Аптека N9,"Могилев, ул. Калиновского, 27А",(0222) 763670,"07.30-21.00, пн.–пт.; 09.00-17.30, сб.; 09.00-17.30, вс.; Перерыв в субботу, воскресенье и праздничные дни: 13:30-14:00; Праздничные дни: 9:00-17:30;",
Наша аптека N9 Аптечное дело ООО,"Минск-Советский, ул. Гикало, 28-2н",(017) 2401086,"09.00-21.00, пн.–пт.; 09.00-21.00, сб.; 11.00-20.00, вс.",
Планета Здоровья Аптека N29 ООО Аптека N28,"Новогрудок, ул. Волчецкого, 36А, пом. 13а Магазин Большая Крыница",+375159731963,"08.30-22.00, пн.–пт.; 09.00-21.00, сб.; 09.00-21.00, вс.; Санитарный день последний вторник месяца 08:00-11:00",
Брестское РУП Фармация Аптека N22,"Каменец, д. Верховичи, ул. Пограничная, 25, в здании амбулатории",(01631) 94864,"08.30-17.00, пн.–пт.; 09.00-11.30, сб.; выходной, вс.; Перерыв в будние дни: 13:00-14:00;                                                         Праздничные дни: выходной;",
Минская Фармация Аптека N44,"Самохваловичи, ул. Ковалева, 22",(017) 5066487,"08.00-18.30, пн.–пт.; выходной, сб.; выходной, вс.; Перерыв: 13:00-13:30; Праздничные дни: выходной;",
Искамед ООО Аптека N60,"Могилев, ул. Якубовского, 90",(0222) 658415,"09.00-20.00, пн.–пт.; 10.00-18.00, сб.; 10.00-18.00, вс.; Санитарные часы: первый четверг каждого месяца с 9:00 до 12:00;",
Планета Здоровья Аптека N16 ООО Космофарма,"Бобруйск, ул. Минская, 111",+375225715525,"09.00-22.00, пн.–пт.; 09.00-22.00, сб.; 09.00-22.00, вс.; Санитарный день 2-й вторник месяца 9:00-12:00",
Брестское РУП Фармация Аптека N227,"Каменец, аг. Каменюки, ул. Пущанская, 14, в здании амбулатории",(01631) 97594,"09.00-17.00, пн.–пт.; 09.00-14.00, сб.; выходной, вс.; Перерыв в понедельник-пятницу: 13:00-14:00;                                                     Праздничные дни: выходной;",
Белана ООО ПКФ Аптека N15,"Брест, ул. Морозова, 27",(0162) 355710,"09.00-21.00, пн.–пт.; 09.00-21.00, сб.; 09.00-21.00, вс.; Санитарные часы: последнее воскресенье каждого месяца с 9.00 до 11.00;",
Гродненское РУП Фармация Аптека N1,"Гродно, ул. Ожешко, 11",(0152) 626135,"08.00-21.00, пн.–пт.; 09.00-20.00, сб.; 10.00-18.00, вс.; Праздничные дни: 10:00-18:00;",
АльфаАптека Аптека N6 ГаленаФарм ООО,"Пинск, пр-т Жолтовского, 19, пом. 2",(0165) 637634,"08.00-21.00, пн.–пт.; 08.00-18.00, сб.; 08.00-18.00, вс.; Санитарные часы: последний четверг месяца с 8.00 до 10.00;",
Брестское РУП Фармация Аптека N23,"Береза, аг. Маревиль, ул. Советская, 17-1",(01643) 47107,"09.00-15.00, пн.–пт.; выходной, сб.; выходной, вс.; Праздничные дни: выходной;",
Витебское УП Фармация Аптека N339,"Витебск, пр-т Московский, 89-42, амбулатория Билево",(0212) 246524,"09.00-17.00, пн.; 09.00-17.00, вт.; 10.00-18.00, ср.; 09.00-17.00, чт.; 09.00-17.00, пт.; выходной, сб.; выходной, вс.; Праздничные дни: выходной;",
